{
  "pr_id": "11111111-1111-1111-1111-111111111111",
  "repo_id": "22222222-2222-2222-2222-222222222222",
  "org_id": "33333333-3333-3333-3333-333333333333",
  "agent_id": "44444444-4444-4444-4444-444444444444",
  "decision_code": "auto_merge_eligible",
  "dedup_score": 0,
  "quality_score": 0.95,
  "reputation_score": 0.9,
  "composite_score": 0.91,
  "reason": "composite_above_auto_merge",
  "decided_at": "2026-05-09T12:00:00Z",
  "_envelope_version": 1
}
